INDIGO-PL-0019,Linkee,,Current,,source1,,Late stage,source1, The program was selected following a call for proposals. IB contract is about to be signed.,Yes,No,No,No,No,No,,source1,,Yes , Call for proposals for IB on ‘circular economy’,source1,,Q1 - 2023,6-12 months,,Apr-21,source1,,"Social and environmental innovation, prevention, and the opportunity to try a new public service which could be replicated elsewhere",source1,,,,,Yes,No,No,No,,source1,,Yes,No,No,,source1,,No,source1,,Yes,No,No,Yes,,source1,Debt / Grant - Upfront investment through bond and outcome payments through grant funding,No,,source1,,EUR,2308000,source1,,Food waste and growing need for food aid,"Logistics for saving surplus food from restaurants, distributors and producers and distributing it to food aid organizations",No,No,No,No,No,No,Yes,No,No,No,,,"2,13",,,source1,,Beneficiaries of food aid,TBD,Individual,,No,No,No,Yes,source1,,,France,FR
INDIGO-PL-0020,Messidor,,Current,,source1,,Final negotiations,"source1,source2", The program was selected following a call for proposals. Evaluation framework is being finalized,Yes,No,No,No,No,No,,source1,,Yes ,Call for proposals for IB on ‘innovating for employment’ for 10M€,source1,,Q1 - 2023,6-12 months,5,Q1-2022,source1,,"Social innovation, prevention, and the opportunity to try a new public service which could be replicated elsewhere",source1,,Finding data for quasi-experimental study (not linked to outcomes payments),source1,,Yes,No,No,No,,source1,,Yes,No,No,,source1,,No,source1,,Yes,No,No,Yes,,source1,Debt / Grant - Upfront investment through bond and outcome payments through grant funding,No,,source1,,EUR,2549044,source1,,Difficulties to access the job market for job seekers with mental disorder and without official disability status,Individual placement and Support (IPS),Yes,No,No,No,No,No,No,No,No,No,,,"8,10",,,source1,,Adults with mental disorder without disability status,380,Individual,,No,No,No,Yes,source1,,,France,FR
INDIGO-PL-0021,Mozaïk RH,,Current,,source1,,Final negotiations,"source1,source2", The program was selected following a call for proposals. Evaluation framework is being finalized,Yes,No,No,No,No,No,,source1,,Yes , Call for proposals for IB on equal economic opportunities for 10M€,source1,,Q1 - 2023,6-12 months,5,Jun-21,"source1,source2",,"Social innovation, prevention, and the opportunity to try a new public service which could be replicated elsewhere",source1,,Finding data for quasi-experimental study (not linked to outcomes payments),source1,,Yes,No,No,No,,source1,,Yes,No,No,,source1,,No,source1,,Yes,No,No,Yes,,source1,Debt / Grant - Upfront investment through bond and outcome payments through grant funding,No,,source1,,EUR,3400000,source1,,Difficulties for poorer students to find a job after they finish their studies and discriminations,"Workshops for preparing students to job interviews and the job market, intermediation and non-discriminatory matching with employing companies.",Yes,Yes,No,No,No,No,No,No,No,No,,,"8,10",,,source1,,Students in higher education with scholarship and/or from Urban Priority Districts,1000,Individual,,No,No,No,Yes,source1,,,France,FR
INDIGO-PL-0022,Télémaque,,Current,,source1,,Final negotiations,"source1,source2", The program was selected following a call for proposals. Evaluation framework is being finalized,Yes,No,No,No,No,No,,source1,,Yes ,Call for proposals for IB on ‘innovating for employment’ for 10M€,source1,,Q1 - 2023,6-12 months,6,Jan-22,"source1,source2",,"Social innovation, prevention, and the opportunity to try a new public service which could be replicated elsewhere",source1,,Finding data for quasi-experimental study (not linked to outcomes payments),source1,,Yes,No,No,No,,source1,,Yes,No,No,,source1,,No,source1,,Yes,No,No,Yes,,source1,Debt / Grant - Upfront investment through bond and outcome payments through grant funding,No,,source1,,EUR,3144000,source1,,Difficulties to access the job market for student in vocational education and in poor territories,Mentoring both at school and outside of school for professional orientation,Yes,Yes,No,No,No,No,No,No,No,No,,,"8,10",,,source1,,Students in vocational education,560,Individual,,No,No,No,Yes,source1,,,France,FR
INDIGO-PL-0023,Toopi Organics,,Current,,source1,,Final negotiations,"source1,source2", The program was selected following a call for proposals. IB contract is about to be signed.,Yes,No,No,No,No,No,,source1,,Yes ,Call for proposals for IB on ‘circular economy’,source1,,Q1 - 2023,6-12 months,,May-21,"source1,source2",,"Social and environmental innovation, prevention, and the opportunity to try a new public service which could be replicated elsewhere",source1,,,,,Yes,No,No,No,,source1,,Yes,No,No,,source1,,No,source1,,Yes,No,No,Yes,,source1,Debt / Grant - Upfront investment through bond and outcome payments through grant funding,No,,source1,,EUR,3822906,source1,,Challenges for organic production,Collecting human urine for producing organic fertilizers,No,No,No,No,No,Yes,Yes,No,No,No,,,"12,13",,,source1,,Producers,TBD,Individual,,No,No,No,Yes,source1,,,France,FR
INDIGO-PL-0024,Wake Up Café,,Current,,source1,,Final negotiations,source1, The program was selected following a call for proposals. IB contract is about to be signed,Yes,No,No,No,No,No,,source1,,Yes , Call for proposals for IB on equal economic opportunities for 10M€,source1,,Q1 - 2023,6-12 months,5,Jun-21,"source1,source2",,"Social innovation, prevention, and the opportunity to try a new public service which could be replicated elsewhere",source1,,,,,Yes,No,No,No,,source1,,Yes,No,No,,source1,,No,source1,,Yes,No,No,Yes,,source1,Debt / Grant - Upfront investment through bond and outcome payments through grant funding,No,,source1,,EUR,2921668,source1,,Reoffending by lack of professional opportunities and discrimination of former offenders,"Job training in prison, individualized support in and outside prison, intermediation with employing companies",Yes,No,No,Yes,No,No,No,No,No,No,,,"8,10",,,source1,,Offenders in the judicial system with difficulties to integrate the job market,648,Individual,,No,No,No,Yes,source1,,,France,FR
INDIGO-PL-0025,Formal Employment SIB Nuevo Leon (Mexico),,Current,,source1,,Late stage,source1,Designing SPV and starting negotiations between government and investors,Yes,No,No,No,No,,,source1,,No,,source1,,Q3 2022,> 24 months,1.875,Q1 2019,source1,Expected duration: 21 months (almost 2 years),The government seeks to change the working relationship with implementers from a grant-based funding model to an outcomes-based funding. To develop an outcome-based intervention model for formal employment that can be later used and replicated in Mexico.,source1,,"(1) To familiariaze key actors to the rationale of outcomes-based financing, government as well as service providers
(2) Secure funding from Outcome Payor given the government transition (the previous government had already included 50% of the project cost on their budget)
(3) Adapt the provider’s services to the impact investors needs",source1,,Yes,No,No,No,,source1,,No,No,Yes,,source1,,Yes,source1,,No,No,No,No,Public trust fund,source1,,No,"Prudential, CitiBanamex and Nacional Monte de Piedad covered the development costs",source1,,USD  ,1000000,source1,"21,000,000 MXP","Around 37% of the population in Nuevo León work in the informal sector, and this level is even higher among youth.","Soft skills, technical skills, 1 to 1 mentoring focused on job placement, and internships in allied enterprises",Yes,No,No,No,No,No,No,No,No,No,Formal employment for vulnerable youth,,"1, 8, 10",,,source1,,"Vulnerable youth age 18-24 from the Metropolitan Area of Monterrey, Nuevo Leon that are currently working in the informal economic sector or unemployed, and that are not studying.",300,Individual,,No,No,Yes,No,source1,,,"Nuevo Leon, Mexico",MX
INDIGO-PL-0026,Innovative Financing Models for boosting employment in vulnerable populations in Mozambique,,Current,,source1,,Early stage,source1,"Post feasibility stage, where four concepts ready for market testing have been indentified and one will be selected. Currently seeking to partner with organisations and funders focused on gender and/or employment outcomes to operationalise these models.",Yes,No,No,No,No,No,Other: innovative financing models with an outcomes orientation,source1,,No,,source1,,Q2 - 2023 or later,12-24 months,TBD,Q4 2020,source1,,"Integrating outcomes-based financing principles into innovative finance models will catalyze new funding for the DUYW employment challenge in Mozambique by (i) creating sharp and shared incentives for all parties to achieve a common goal, and (ii) facilitate new partnerships, including with the private sector, that allows different capabilities, perspectives and networks to work together for a common good",source1,,"(1) Securing funding to take one or more of the models through to feasibility stage
(2) Operationalise the detailed concepts that have been developed in the scoping phase",source1,,No,No,No,No,Yes,source1,,Yes,No,No,,source1,,Yes,source1,,No,No,No,No,Key project terms will be identified in subsequent feasibility stages,source1,,Yes,,source1,,USD,Ranging from potential $500k to $20m (varying significantly between models and the appetite of funders),source1,Up to $20 million,"50 % of Mozambicans are still living in poverty and social and economic inequalities are continuing to grow. The challenges faced by disadvantaged urban youth and women (DUYW) are severe. Without deliberate intervention to address the constraints facing them, this trend is set to worsen. MUVA, a Mozambican NGO supporting women’s economic empowerment, in collaboration with Social Finance, identified four outcomes-oriented innovative finance intervention models with the potential to enable DUYW  to access jobs and economic opportunities. Each responds to a specific set of challenges: (i) addressing the visible and invisible gender-specific barriers young women face when entering the workforce, (ii) the technical and financial support needed to incubate DUYW entrepreneurs, and (iii) the culture change required from larger employers to accommodate young women.
(Scoping report: https://www.socialfinance.org.uk/sites/default/files/publications/muvareport.pdf)","(1) a Female Economic Empowerment and Employment DIB
(2) an Early Stage Enterprise Catalytic Fund
(3) a Gender-Impact Blended Finance Fund
(4) an outcomes-oriented Public Goods Cash Transfer programme",Yes,No,No,No,No,No,No,No,No,No,,,"10, 5, 8",,,source1,,"Demand side: disadvantaged urban youth and young women in Mozambique
Supply side: enterprises, ranging from subsistence entrepreneurs to larger enterprises",TBD,Individual,,Yes,No,No,No,source1,,,Mozambique,MZ
INDIGO-PL-0027,Outcomes based financing for scaling Sanergy’s container-based sanitation services in informal low-income settlements in Nairobi,,Current,,source1,,Early stage,source1,An initial scoping has been conducted and a feasibility study is at the mid stages with start of design planned for Q2 of 2022,Yes,No,No,No,No,No,,source1,,No,,source1,,Q1 - 2023,12-24 months,4.5,March 2021,source1,,"Scaling up Sanergy’s offering will bring economies of scale and efficiencies to the delivery of their services. The long term ambition is to achieve financial sustainability via results-based contracts with municipalies. The proposed outcomes-based model will create a natural bridge from donor subsidies to municipality funding, by allowing external funding to taper out as local funding tapers in, avoiding funding cliff-edges or re-procurement risks",source1,,Securing the level of outcomes funding needed to deliver scale and impact,source1,,No,No,Yes,No,,source1,,No,No,Yes,"Stone Family Foundation, an existing grant funder of Sanergy and investor in the Cambodia Rural Sanitation DIB, connected Sanergy with Social Finance with the ambition that SF could support Sanergy in exploring a move towards outcomes-based funding, building off experience from the Cambodia DIB",source1,,Yes,source1,,Yes,Yes,No,Yes,Other: likely to need to be an investor (or investors),source1,,Yes,Social Finance has been contracted by Sanergy to provide technical assistance to support the financial model and suitability analysis required in order to demonstrate the role of outcomes-based funding,source1,,TBD,TBD,source1,,"Currently, 60 million new residents move to urban areas every year. One in four lives in slums, amounting to over 1 billion people. The vast majority (more than 70%) have no access to safe sanitation services and, in effect, are living in their waste. In Kenya this issue is clear and in Nairobi alone, 60% of the population live in informal settlements and 60% of the city remains unconnected to the sewerage system.","Sanergy, established in 2011 to address the sanitation value chain in the low-income informal settlements of Nairobi, provides container-based sanitation services, offering an end to end sanitation solution to residents. These waterless sanitation facilities are leased to local residents, who pay a monthly subscription fee to be part of the network. Sanergy collects the waste through a professional logistics team, provides operational and maintenance support, liaises with government to ensure compliance, and guarantees that all waste is safely treated.",No,No,No,No,No,No,No,Yes,No,No,,,"6,11,17",,,source1,,Informal settlements in Nairobi,700000,Individual,,No,Yes,No,No,source1,,,Kenya,KE
INDIGO-PL-0028,Results-Based Financing for container-based sanitation services in northern Haiti,,Current,,source1,,Late stage,source1,,No,No,No,No,Yes,No,,source1,Grant-based incentive payments upon pre-agreed results,No,,source1,,Q2 - 2023 or later,12-24 months,4,Q1 2019,source1,,"Scaling SOIL’s market-based approach by reducing costs through economies of scale, creating incentives for cost-efficient operations and proving a mechanism which could later be replicated for public funding of sanitation services in urban Haiti.",source1,,"(1) Misalignment of objectives between the Haitian government and the potential outcomes funder, due to the latter ‘moving the goalposts’ on program scope and intended outcomes.
(2) Potential outcomes funder sought to impose unrealistic cost recovery targets over a short period of time.",source1,,No,No,Yes,No,,source1,,No,No,Yes,,source1,,Yes,source1,,No,No,No,Yes,,source1,,No,,source1,,USD,5000000,source1,Estimate of USD 3-5 mn,"In Haiti, only 30% of the population has access to improved sanitation and less than 1% of waste is safely treated. This has fueled one of the most virulent cholera epidemics in recent global history. While aquatic ecosystems become increasingly polluted with nutrients from human waste, the earth’s soil nutrients have been rapidly declining due to erosion and intensive agricultural practices, leading to a loss of biodiversity, extreme vulnerability to climate-related risks, reduced agricultural production, poverty, and malnutrition. As Haitian cities expand, unplanned, at staggering rates, it’s critical that the sanitation sector develops innovative approaches that work in dense urban areas to avoid exacerbating the toll of preventable waterborne diseases.","SOIL operates an integrated waste management system, from containment of human waste through safe transportation to treatment. This program focuses on expansion of SOIL’s ‘EkoLakay’ container-based household sanitation service and to safely transport and treat the associated waste",No,No,No,No,No,No,No,Yes,No,No,,,6,,,source1,,Households in urban and peri-urban areas in Haiti’s Grand North region,3350,Other,Households  ,No,Yes,No,No,source1,"Approximately 3350 households (approximately 20,000 people)",,Haiti,HT
INDIGO-PL-0029,Armenia Dairy Productivity DIB,,Current,,source1,,Early stage,source1,In mid to late stages with first iteration of design having been largely completed. Funders needed and then looking to engage service providers to co-create and finalise the design,Yes,No,No,No,No,No,,source1,,No,,source1,,Q2 - 2023 or later,>24 months,6,2020/2021,source1,,"An impact bond aligns partners around shared incentives and associated accountability which is necessary to solve the inter-related market failures in Shirak dairy production leaving many smallholders without an avenue to earn their wayout of poverty. Rigorous monitoring and focus on outcomes measurement in an impact bond allows the programme to focus on changes in household income net of production costs, producing a more realistic measure of impact than other programmes. In an area where multiple interventions have not achieved sustained impact, an impact bond provides the flexibility to innovate in service delivery as well as strong feedback loops to understand what works. This is complemented by a focus on value for money which has been lacking in a number of other input-driven agricultural progammes.",source1,,"1. The complexity of the issues area and number of interrelated challenges makes the context of operation complex
2. A lack of publicly available data on smallholder numbers, costs and intervention costs means that further iterations of the programme design and payment mechanism will be necessary
3. Lack of infrastructure and applicable public and private financial mechanisms to secure the sustainability of activities to be implemented during the project",source1,,No,No,Yes,No,,source1,,Yes,No,No,"Service providers not yet selected . The procurement process has not been finalised but is anticipated to be open procurement following an RFP, potentially with an EOI stage before that",source1,,Yes,source1,,No,No,No,No,,source1,,Yes,,source1,,USD,4000000,source1,,"The poverty rate in the Shirak region is significantly higher than the Armenian average and agriculture, particularly dairy farming, is a key source of income. Dairy farming is however charactrised by low-input subsistence activity that leads to persistently high levels of smallholder poverty, indebtedness and outward migration. Low dairy productivity coupled with market failures in the dairy value chain mean that the market operates at a low-level equilibrium of poor quality and low prices, with little possibility of smallholders being able to pull themselves out of poverty","Holistic intervention that could include a multifaceted service package designed across four pillars of infrastructure, agricultural practices, operations and market linkages:
1)        Infrastructure: provide capital for processor and/or smallholder infrastructure investments, acting as co-finance where existing grant-programmes exist.
2)        Agricultural practices: provide training and vet services to improve smallholder practices.
3)        Operations: provide temporary input subsidies, which could be used to de-risk the additional costs associated with adopting new on-farm practices.
4)        Market linkages: support the development of market infrastructure/systems to promote quality-responsive milk pricing from processors, including the potential introduction of milk collection and cooling points. ",Yes,No,No,No,No,Yes,No,No,No,No,,,"1, 2, 3, 8, 9, 10, 11, 12, 15, 17",,,source1,,Dairy processors and smallholders (with between 3 and 19 cows) in Shirak,2708,Individual,,No,No,Yes,No,source1,"Approximately 2,700 smallholders and 8 dairy processors",,"Shirak, Armenia",AM
INDIGO-PL-0030,Jordan Early Childhood Development DIB,,Current,,source1,,Late stage,source1,,Yes,No,No,No,No,No,,source1,,No,"Although not part of a larger outcomes-based financing programe, this impact bond is part of a wider payment-by-results program. The project is linked to the Jordan Education Reform Support Program-for-Results, a $300 million program financed by the World Bank. The program disburses upon achievement of pre-defined results, including – among other things –the development of a PPP modality to expand access to KG, and the number of KG classrooms established and operational under such a modality",source1,,Q2 - 2023,12-24 months,TBD,Q1 2019,source1,,"Outcomes-based contracting offers an opportunity to improve the transparency and accountability of providers within the private KG market, while helping to align incentives such that national efforts to expand access are also focused on assuring quality.",source1,,"(1) Owing to COVID-19 disruptions, the feasibility study was pushed back to late 2021
(2) As this is early stage work, there has been no outreach to potential investors or outcomes funders and so the funder interest is currently unknown.",source1,,Yes,No,Yes,No,,source1,,Yes,No,No,A comprehensive provider market survey in Amman and Irbid Governorates will be conducted as part of the feasibility study. A provider selection process with be co-developed with World Bank and MOE stakeholders,source1,,Yes,source1,,No,No,No,No,,source1,TBD,Yes,The World Bank commissioned the scoping and feasibility studies,source1,,TBD,TBD,source1,,"Enrolment in kindergarten is low in Jordan at 41% of the 4-6 year old population and private KGs make up 71% of that provision (compared to 24% at primary level). To achieve the Government’s ambition to universalise KG access, the Ministry of Education of Jordan is seeking to expand access to high quality KG education through the design and implementation of innovative partnerships with the private sector.","Package of support to eligible private KG providers to improve access to high-quality education services to lower-income households (likely to include support to physical expansion of school, pedagogical and school management training)",No,Yes,No,No,No,No,No,No,No,No,,,"4, 10",,,source1,,"Private KGs operating in Amman and/or Irbid Governorates, delivering services to children aged 4-6 from lower-income households",TBD. Cohort size will be dependent on the findings of a comprehensive private KG market survey. This is one of the first of its kind providing rich data on private KGs to be used to inform reasonable scope of beneficiaries.,Individual,,No,No,Yes,No,source1,,,"Amman, Irbid",JO
