INDIGO-PL-0031,Eye Health Social Impact Guarantee,,Current,,source1,,Scoping,source1,Vision Catalyst Fund is working with Tri-Sector Associates to conduct a market mapping and issue identification exercise. This exercise will tentatively be completed in March before we move into the feasibility study stage,No,No,No,Yes,No,No,,source1,,No,,source1,,Q2 - 2023,12-24 months,2,Q4-2021,source1,,"- Guarantees Upfront Funders the target outcomes that they desire. In the event that these outcomes are not achieved, the guarantee will be called, and they will get some of their funding back.
- Incentivises service providers to focus on delivering outcomes and move away from outputs. 
- Mobilises new sources of funding by providing a guarantee to non-traditional funders of eye health to incentivize the funding of vision-related interventions; the guarantee can be tied to outcomes that are of importance to non-traditional funders (e.g. education or livelihood outcomes)
- Catalyses an inflow of more upfront funding if applied at scale, as the same dollar can be used to guarantee different projects. By developing a portfolio of SIGs, one can create significant leverage by using the same dollar to provide SIGs to multiple projects. 
- Encourages strong performance management through the set-up of formal governance structure and rigorous evaluation practices among service providers so that service providers can continue to build evidence-based interventions..",source1,,"Funding flowing into the eye health space does not reflect the value that good eye health can bring to society. There is a need to educate stakeholders on the Social Impact guarantee, a new outcomes-based contracting model.",source1,,No,No,No,No,TBD,source1,"The goal of this project is to support the government in developing a government-owned, sustainable eye health programme nationwide that will have lasting impact and improve the social-economic status of Vietnam’s citizens. The intention is that the Government of Vietnam is consulted throughout the project including the co-creation process with the service providers. The aim of the project is to support the rollout of the Government's National School Eye Health Guideline through capacity building and technical assistance to the Ministry of Health and Ministry of Education.",No,No,No,,source1,TBD,No,source1,,No,No,Yes,No,"Upfront funding would be structured as a grant, but the funder can purchase a guarantee which gets called if outcomes are not met",source1,,Yes,Vision Catalyst Fund has provided a technical assistance grant to Tri-Sector to initiate the development of the project,source1,,USD,3600000,source1,,"More than a billion people in the world have poor vision. The solutions are already available for 90% of them through cost-effective solutions like glasses and cataract surgery. Low- and middle-income countries are home to 90% of visually impaired persons. Women and girls experience the majority of vision loss and are less likely to receive care. There is an estimated $410 billion annual global cost of productivity losses associated with vision loss. The World Health Organization estimates it would take $24.7 billion to close the gap for unaddressed refractive errors and cataracts globally.
Poor vision is a major public health problem in Vietnam for school-going children. Over 3 million school children have a visual impairment, and they face challenges in accessing high quality services and assistive technologies. In Vietnam, prevalence of uncorrected refractive error among urban school children aged 6–15 years is 25–40%, which is one of the highest in the world. Of those who have uncorrected refractive error, only 33% of them have access to a pair of spectacles, which 60% of the time is likely an incorrect prescription. Key drivers included the lack of consideration of eye health in prior school health policy frameworks, the lack of guidelines for implementing vision screening during annual school health check-ups for children, poor awareness of the importance of eye health among teachers, and the lack of training resources for school nurses and teachers to provide eye health services and referrals. School eye health is now an important priority for the government. In February 2022, the Government of Vietnam announced the objective of implementing the National School Eye Health Guideline across all schools in Vietnam. ","The intervention will work to strengthen the rollout of the Vietnamese Government's National School Eye Care guidelines. Activities will include school-based screening, diagnosis, referral, and treatment interventions, along with educational communications campaigns to facilitate preventative eye care. The programme is taking a systems strengthening approach including capacity building, health system integration and development of new processes. ",No,No,No,No,Yes,No,No,No,No,No,,,3,,,source1,,"The primary target population is school children from 6–15 years old, prioritising economically disadvantaged and ethnic minority communities.",TBD (dependent on the intervention which we are still developing),Individual,,No,Yes,No,No,source1,,,"Cambodia, Nepal, and others, Bangladesh, Indonesia, Vietnam","BD, NP, KH, VN, ID"
INDIGO-PL-0032,Championing the World’s first Adolescent Sexual Reproductive Health Development Impact Bond in Kenya,,Launched,,source1,,Final negotiations,source1,"The project has secured resource commitments from the SDG Outcome Fund equivalent to $7m over a period of 3 years. Discussions are ongoing with social impact investors such as CIFF, UBS Optimus, Grand Challenges Canada, and Norad for financial leverage to a tune of $18 million. These resources will either come in the form of outcome fund contribution or impact capital to finance the development impact bond.",Yes,No,No,No,No,No,,source1,,Yes,The project seeks to unlock outcome funds resources from the SDG Joint Fund and equally mobilize resources from other potential outcome funders and social investors,source1,,Q4 - 2022,6-12 months,3,Q1 2022,source1,,"To demonstrate results, to adopt a paradigm shift from funding to financing and to incenvize potential investors towards financing the SDGs",source1,,,,,Yes,Yes,Yes,No,,source1,,No,Yes,No,,source1,,Yes,source1,,Yes,Yes,No,Yes,Other: Development Impact Bond,source1,,Yes,Technical assistance provided in the design of the project,source1,,USD,18000000,source1,,"Teenage pregnancy, new HIV infections and AIDS related deaths among adolescent girls in Kenya",Tech-based service delivery model that places adolescent girls at the centre,No,No,No,No,Yes,No,No,No,No,No,,,"3,5,7",,,source1,,Adolescent girls (15-19 years),200000,Individual,,No,Yes,No,No,source1,,,Kenya,KE
INDIGO-PL-0033,Namibia Early Childhood Development Social Impact Bond,,Current,,source1,,Late stage,source1,Provisional SIB design was delivered in July 2021. Further government engagement being performed as the gov. of Namibia will be a co-outcome payer. Additional service provider to be selected through an RfP process.,Yes,No,No,No,No,No,,source1,,No,,source1,,Q1 - 2023,12-24 months,5,Q4 2020,source1,,"More efficient use of funds for the outcome payers. Incentivization of service provider. Test the approach with the Gov. of Namibia, which if successful, could be scaled across the country and maybe replicated in other African countries.",source1,,"(1) Limited / low maturity ECD service provider landscape in Namibia
(2) Government engagement (convincing, figuring out who and how to contract with government)",source1,,Yes,No,Yes,No,"Implement/roll out complementary ECD strategies, supervise verification process",source1,,Yes,No,No,"By recommendation form Interteam. However, a final selection process will be conducted through a competitive process.",source1,,Yes,source1,,No,No,No,Yes,"Grant: the outcome payment, Other: risk funding by the investor with a certain principal guarantee",source1,,Yes,"Grants for advocacy and engagement of policy makers, and for the SIB design",source1,,EUR,5000000,source1,,ECD access and quality in Namibia remains a serious challenge despite the momentum that the Namibian government has mobilized over the past five years.  Only 13% of children aged 0-4 are enrolled in ECD centers and just 31.4% of children are enrolled in pre-primary. Lack of ECD quality contributes to high repetition rates in primary and secondary levels.,"Increase access to ECD with a focus on both the demand (parents) and supply side (centres capacity). Improve quality of ECD centers focusing on providing i) teaching and learning materials to ECD teachers, ii) trainings to ECD teachers on pedagogical approaches and management capacities, and iii) grants to ECD centers to improve their physical facilities.",No,Yes,No,No,No,No,No,No,No,No,,,4,,,source1,,"Approx. 45,000 children aged 0-6 in 400 ECD centres",45000,Individual,,No,No,Yes,No,source1,"Approx 45,000 children and 400 ECD centers",,Namibia,NA
INDIGO-PL-0034,Impact Bond to address Child Labour in the Cocoa Value Chain in Côte d’Ivoire,,Current,,source1,,Early stage,source1,"Feasibility study completed in 2021, main finding: impact bond targeting child labour elimination in the cocoa sector in Côte d’Ivoire is feasible => 2022: engaging local and international stakeholders to share results of feasibility study and jointly define way forward including decision whether design stage will take off",Yes,No,No,No,No,No,,source1,,No,,source1,,Q4 - 2022,TBD,TBD,TBD,source1,,Going to scale,source1,,"(1) Covid-19
(2) Aligning and obtaining buy-in from all concerned (local) stakeholder groups",source1,,No,No,No,No,TBD,source1,,No,No,No,TBD,source1,,Yes,source1,,No,No,No,No,TBD,source1,,Yes,Funded by the Dutch government under a broader funding to the ILO on child labour elimination,source1,,TBD,TBD,source1,,Addressing child labour incidence in the cocoa sector in Côte d’Ivoire,"(1) School feeding programme
(2) Quality education",Yes,Yes,No,No,No,No,No,No,No,No,,,8,,,source1,,Primary school children,10000-50000,Individual,,No,Yes,No,No,source1,"Three target numbers based on Impact Bond size (10,000/25,000/50,000 children)",,Côte d’Ivoire,CI
INDIGO-PL-0035,Education Impact Bond,,Current,,source1,,Early stage,source1,"The project is now the validation of initial feasibility and rapid development and design of an impact bond on education in Pakistan. We seek to launch a simple (minimum providers, outcomes funders and investors) impact bond within 12 months",Yes,No,No,No,No,No,,source1,,No,,source1,,Q2 - 2023 or later,6-12 months,TBD,Q2 2022,source1,,"Target specific marginalised group (middle school girls) and allocate resources for specific interventions that support outcomes for this group
- Can unlock capital towards new programmatic approaches that have thus far not succeeded at attracting funding (due to being deemed too risky)
- Enable incorporation of retention focused metrics (rather than just enrolment) in programme delivery given transfer of risk
- First impact bond in Pakistan, with wider ambition to kick-start the local market",source1,,"(1) Changing political landscape and uncertainty
(2) Unknown challenges in a new market such as legal and regulatory obstacles to overcome",source1,,No,No,No,Yes,,source1,,No,No,No,Too early stage,source1,TBD,Yes,source1,,Yes,No,No,Yes,To be confirmed at a later stage,source1,,No,,source1,,USD,10000000,source1,This might be a ~$5M-10M transaction,Pakistan's progress towards achieving SDG 4 to ensure inclusive and equitable quality education and promote lifelong learning opportunities for all by 2030 has remained stagnant as the sector continues to face challenges.  Economic shocks from Covid-19 have further strained education funding with overall contraction of the economy and competing allocations to health and other relief measures.,TBD. Interventions identified during feasibility study: high-quality private service providers operate school networks and are PPP partners that can focus on improving functionality of government schools and/or establishment of new schools,No,Yes,No,No,No,No,No,No,No,No,,,4,,,source1,,"Middle and secondary school children, with an emphasis on increasing enrolment and retention of girls",TBD,Individual,,No,Yes,No,No,source1,,,Pakistan,PK
INDIGO-PL-0036,Refugee Impact Bond (Second Tranche),,Current,,source1,,Late stage,source1,The Refugee Impact Bond 1st tranche is closed and launched. Fundraising is ongoing for the 2nd tranche in Lebanon with first investor comittment from DFC confirmed,Yes,No,No,No,No,No,,source1,,Yes,The project is the 2nd tranche of the Refugee Impact Bond. The 1st tranche was launched in Jordan in September 2021.,source1,,Q2 - 2023 or later,6-12 months,4,Q1 2016,source1,,"Livelihoods programmes have great potential to improve refugees’ living conditions and to boost the host country’s economy, as refugees spend the money they earn. However, they are a relatively new area for humanitarian organisations and can be challenging to implement, which means traditional donors are reluctant to take the risk of funding them. When programmes do exist, results are often disappointing owing to top-down or ‘one-size-fits-all’ approaches. Finally, funding contingent on activity-based annual cycles, hampers efficacy and innovation. The DIB transfers the risk of funding a multi-year livelihoods programme to investors. Beyond risk externalisation, the DIB also provides high value-for-money for the donors.",source1,,Raising the necessary outcome funding commitments.,source1,,No,No,No,Yes,,source1,,Yes,No,No,Service provider was selected out of a shortlist of providers short-listed during feasability study. Final candidate selected following a stringent due diligence process.,source1,,Yes,source1,,Yes,No,No,No,,source1,,Yes,The feasability study was funded by Convergence. The structuring phase was funded by Convergence and IKEA Foundation.,source1,,USD,8800000,source1,,"Worldwide, conflict and climate crises are forcing more people than ever from their homes, with displacement and its impacts lasting years beyond the crisis. The Syrian conflict has driven 6.6 million people to flee Syria with 80% settling in neighbouring countries. This puts a strain on local economies and infrastructure as well as leaves refugees and their host communities struggling to access safe and dignified work, basic services, and affordable housing.","Near East Foundation will implement a micro-enterprise, vocational trainings and grants programme. The programme will support 3,000 refugees and Lebanese through business development and resiliance-building trainings. The majority of these will also receive start-up grants and coaching sessions to support the launch of their micro enterprise.",Yes,Yes,Yes,No,No,No,No,No,No,Yes,Livelihood programs in humanitarian contexts,,"1, 4, 5, 8, 10, 17",,,source1,,Vulnerable refugees and host communities (75% women and 30% youth),3000,Individual,,No,No,Yes,No,source1,,,Lebanon,LB
INDIGO-PL-0037,Menstrual Health and Hygiene DIB (Second Tranche),,Current,,source1,,Late stage,source1,"First tranche launched in Ethiopia in February 2022. Second tranche to be launched upon commitments of outcome funders and investors (e.g., in other regions in Ethiopia, in Niger, structuring has been done).",Yes,No,No,No,No,No,,source1,,No,,source1,,Q2 - 2023 or later,6-12 months,3,2019,source1,,"(1) Experiment a comprehensive intervention to address menstrual health and hygiene challenges
(2) Build evidence of the impacts of such intervention
(3) Develop a dialogue with policy makers to replicate and scale the intervention
(4) Risk transfer from providers and donors to social investors",source1,,"(1) Hard to secure outcome funding
(2) Complexities around the financial structure for the pre-financing of the Ethiopian DIB
(3) Measurability of outcomes given undocumented sector and no track record of interventions
(4) Fragmented ecosystems of service providers",source1,,No,No,Yes,No,,source1,,Yes,No,No,,source1,,Yes,source1,,Yes,No,No,No,,source1,,Yes,"AFD financed the feasibility, the structuring, and the preparation of the NGO pre-signing",source1,,EUR,16200000,source1,Up to EUR 5-15m per new geography/country (1st tranche in Ethiopia: EUR 3million),"Menstruation is a key component of a woman’s life. Yet it remains a taboo in many cultures, including in Africa and India. In these countries, the issue has been consistently overlooked, underestimated, and underfunded. For instance, 70% of adolescent girls in Ethiopia and over 52% in India learn about menstruation after menarche from an older sister or peers at school. Due to lack of awareness, many girls adopt unhygienic practices, which can have negative impacts on their health. Girls also feel less confident because of the lack of sanitary facilities at schools and unavailability of better sanitary products. This impacts their ability to attend school or work in appropriate conditions. Ultimately, it perpetuates stigma and gender inequality.","(1) outreach campaigns to change practices, behaviours and attitudes
(2) development of a local market for menstrual products
(3) improvement of sanitary infrastructure",No,Yes,No,No,Yes,No,No,Yes,No,No,,,"3, 4, 5, 6, 8",,,source1,,"Adolescent girls, women and their communities, including boys and men",TBD,Individual,,No,Yes,No,No,source1,TBD (number of beneficiaries for 1st tranche: 325k),,Ethiopia (new region) or other Sub-Saharan country,ET
INDIGO-PL-0038,Youth and Young Women Livelihoods DIB in Senegal and Tanzania,,Current,,source1,,Early stage,source1,Feasibility Study conducted in 2018. Currently finalising a Scoping and Marketing study with the objective to confirm service providers’ interest in participating to the DIB and secure expressions of interest from a pool of potential outcome funders and investors. Structuring phase expected to start in Q2-Q3 2022 – fundraising for the structuring costs ongoing.,Yes,No,No,No,No,No,,source1,,No,,source1,,Q2 - 2023 or later,12-24 months,4,Q4 2021,source1,,"Clear outcomes identified to finance these interventions through a DIB, will to strengthen service’s providers capabilities in delivering in the context of a RBF mechanism",source1,,Securing outcome funding in a post-pandemic context,source1,,No,No,Yes,No,Domestic governments will be consulted to ensure alignment of interventions with national priorities and will be engaged to design the exit strategy and ensure a sustained impact of the interventions,source1,,No,No,No,n/a – service providers to be selected during the structuring phase. Methodology selection will depend on the Outcome Funder.,source1,TBD,Yes,source1,,Yes,No,No,Yes,,source1,,No,TBD,source1,,USD,1500000,source1,USD$5-15m funding requirement estimated during the feasibility study per country,The analysis of Senegal’s and Tanzania’s socio-economic contexts showed a mismatch between available skills and job market needs as well as the vulnerability of the youth and particularly young women when it comes to unemployment or decent employment. The development of both vocational training to equip young people with adequate competencies and entrepreneurial skills stands out among the main priorities identified in both countries. Access to capital for the youth and young women is also a key issue identified.,"Feasibility study confirmed the relevance of 5 types of interventions: life-skills development, vocational training, support to entrepreneurship, job placement services and financial inclusion. Intervention model to be further defined around at least one of these categories in collaboration with the selected service provider(s) during the strucuturing phase.",Yes,Yes,No,No,No,No,No,No,No,No,Other: Gender,,"1, 4, 5, 8, 10, 17",,,source1,,Young people aged 15 to 35 years old with a specific focus on young women,TBD during the structuring phase,Individual,,No,Yes,No,No,source1,,,"Senegal, Tanzania","SN, TZ"
INDIGO-PL-0039,INNOVAEDU: Pago-Por-Resultados de Innovaciones Educativas en El Salvador,,Current,,source1,,Early stage,source1,Right now both operations are in the stage of design.,Yes,,,No,No,,,source1,,No,,source1,,Q4 - 2022,12-24 months,3,Q4 2021,source1,,Promote a culture of intervention based on result and engage private actors,source1,,"Identifying actors with disposition to co-create this intervention, fast learning about the instruments, identifying private investors that could support the model and developing a market",source1,,Yes,No,No,No,Informed and possible scale,source1,,No,No,No,"Scoping study conducted last year, there where some possible providers pre-identified",source1,,Yes,source1,,No,No,No,Yes,,source1,,No,,source1,,USD,1500000,source1,$1.5MM,"Throughout the last decade, El Salvador has faced multiple educational challenges that has conditioned its socioeconomic development and slowed its progress towards quality, inclusive and equitable education, eg. violence in schools, overage students, low quality educational offer and of little relevance to the needs of the future labor market, among others. All these challenges contribute to the “funnel effect” of exclusion from the educational system: “many start, few finish, and those who learn are even fewer” . In essence, the funnel effect explains the impact that multiple barriers have on students' educational trajectories towards reaching minimum levels of learning necessary for work and life, and which have been exacerbated by Covid-19. Within this framework, this project will address two interrelated challenges: (i) Early dropouts at the secondary level, and (ii) acquisition of Skills for the 21st century.","TBD. Interventions primarily targeting to increase STEM knowledge and abilities, as well as to reduce drop out rates",No,Yes,No,,No,No,No,No,No,No,,,"4, 5",,,source1,,Secondary students from 5th - 7th grades in Honduras and from 7th-9th grades in El-Salvador in both countries with a gender focus.,1500,,,,,,,source1,"Approximately, 1000 – 1,500, 40% - 50% girls",,El Salvador,SV
INDIGO-PL-0043,The Future Hope of Addis,,Current,,source1,,Early stage,source1,There is clear RBF value add in the Future Hope of Addis program that the City Administration is currently implementing. Internal discussions are undergoing to decide whether we will move ahead with the Design phase,No,No,No,No,Yes,No,Performance-Based-Aid,source1,,No,,source1,,Q2-2023 or later,12-24 months,TBD,Q2-2022,source1,,"Focus on results, improve accountability to desired results, evidence generation of cost-effective ECD interventions and crowd-in additional funding",source1,,"• Complex design due to the holistic nature of the program and engagement with multiple stakeholders involved in the program
• The program requires high levels of support to the City Administration to develop the necessary capacities for the implementing actors, strengthen coordination, and create the right accountability mechanisms to achieve the ambitious results of the program",source1,,No,Yes,No,No,The City Administration of Addis Ababa will be the incentivized agent,source1,,No,Yes,No,Government service providers will implement the intervention,source1,"There is no selection of provider as the RBF program aims to strengthen the government´s delivery system. Therefore, public providers will be responsible for implementing the program.",Yes,source1,,No,No,No,Yes,Performance-based aid,source1,,Yes,A grant was awarded to develop the feasibility study,source1,,TBD,TBD,source1,,"Improve access to quality ECD, decrease under 5-mortality rates, underweight and stunting","The Future Hope of Addis takes a comprehensive,  multisectoral approach to addressing the developmental needs of children. It includes the following strategic initiatives
1.        Provision of coaching, health, and social support for parents and caregivers, including prenatal and postnatal advice and supplementary feeding for vulnerable children to improve child nutrition and reduce the stunting rate
2.        Establishment of community-run early childhood development centres
3.        Establishment of publicly financed day care centres between the ages of seven months and three years
4.        Expansion of equitable access to quality preschools for four to six year-old children
5.        Promotion of learning through play within a child-friendly environment
6.        Establishment of a Centre of Excellence for ECD in Addis Ababa to improve workforce capacities to provide developmentally appropriate pedagogies to build and advance a sustaining early childhood development sector in Ethiopia",No,Yes,No,No,No,No,No,No,No,No,Early Childhood Development,,"2, 3, 4",,,source1,,TBD,TBD,,,Yes,No,No,No,source1,TBD for the RBF component. Current program being implemented by the City Administration aims to reach all 1.6 million children in Addis Ababa between 0-6 years old by 2026.,,"Addis Ababa, Ethiopia",ET
